{
  "schema_version": "1.0.0",
  "fixture_data": true,
  "task_id": "render_task_demo_001",
  "project_id": "edit_project_demo_001",
  "project_revision": 1,
  "variant_id": "edit_variant_demo_a",
  "status": "completed",
  "progress": 100,
  "current_step": "completed",
  "attempt_count": 1,
  "max_attempts": 2,
  "output_id": "render_output_demo_001",
  "error": null,
  "created_at": "2026-08-29T12:05:00Z",
  "updated_at": "2026-08-29T12:06:00Z"
}
